{
  "$schema": "../schemas/vera-application-envelope.schema.json",
  "schema_version": "somavera.vera-application-envelope.v1",
  "profile_status": "freeze_blocking_draft",
  "envelope_id": "1212121212121212121212121212121212121212121212121212121212121212",
  "network_lineage_id": "somavera:network:v1:bbbbbbbbbbbbbbbbbbbbbbbbbbbbbbbbbbbbbbbbbbbbbbbbbbbbbbbbbbbbbbbb",
  "execution_context_id": "somavera:context:v1:aaaaaaaaaaaaaaaaaaaaaaaaaaaaaaaaaaaaaaaaaaaaaaaaaaaaaaaaaaaaaaaa",
  "sender_did": "did:key:example-soma-agent",
  "destination_host_did": "did:key:example-vera-host",
  "recipient_ingestion_key_id": "did:key:example-vera-host#ingestion-1",
  "inner_event_id": "1313131313131313131313131313131313131313131313131313131313131313",
  "consent_grant_id": null,
  "stream_id": "1414141414141414141414141414141414141414141414141414141414141414",
  "ciphertext_root": "1515151515151515151515151515151515151515151515151515151515151515",
  "plaintext_bytes": 512,
  "outer_nonce": "1234567890abcdef1234567890abcdef",
  "issued_at": "2027-01-01T00:00:00Z",
  "expires_at": "2027-01-01T00:05:00Z",
  "signing_key_id": "did:key:example-soma-agent#signing-1",
  "signature": {
    "suite": "Ed25519-v1",
    "key_id": "did:key:example-soma-agent#signing-1",
    "value": "AAAAAAAAAAAAAAAAAAAAAAAAAAAAAAAAAAAAAAAAAAAAAAAAAAAAAAAAAAAAAAAAAAAAAAAAAAAAAAAAAAAAAA=="
  }
}
